{
  "budgets": {
    "max_agents": 3,
    "max_cost_eur": 0,
    "max_tokens": 12000,
    "max_wall_ms": 20000
  },
  "composition": {
    "canonical_id": "codigo_estacion",
    "entity": "estacion",
    "kind": "join",
    "on_missing": "hueco_explicito",
    "tasks": [
      "t1",
      "t2"
    ]
  },
  "plan_id": "dpl_7a3b9c1e4f20",
  "policy_version": "pol-2026-07-21",
  "principal_id": "usr_a91f",
  "response_mode": "DELEGATE_MULTI",
  "schema_version": "1.0",
  "tasks": [
    {
      "agent_id": "agent.vigia",
      "budgets": {
        "max_cost_eur": 0,
        "max_tokens": 6000,
        "max_wall_ms": 10000
      },
      "delegated_identity": "idr_7f3a9c1e2b40",
      "entities": {
        "periodo": "mes_actual"
      },
      "expects": "facts",
      "locale": "es",
      "objective": "alarmas por estación del mes en curso, top 10",
      "task_id": "t1"
    },
    {
      "agent_id": "agent.plendata",
      "budgets": {
        "max_cost_eur": 0,
        "max_tokens": 6000,
        "max_wall_ms": 10000
      },
      "delegated_identity": "idr_7f3a9c1e2b40",
      "entities": {
        "periodo": "mes_actual"
      },
      "expects": "facts",
      "locale": "es",
      "objective": "margen por estación del mes en curso",
      "task_id": "t2"
    }
  ],
  "turn_id": "trn_18ab44de"
}
